<?xml version="1.0" encoding="UTF-8" standalone="no"?>
<!DOCTYPE Resource SYSTEM "Wik/sty.dtd"> 
<Resource type="aamap" author="Wik" category="dogfight" name="silo" version="110714">
<Map version="2">
<World>
<Field>
<Spawn x="30" y="81.5" angle="0"/>
<Spawn x="243.2" y="30" angle="90"/>
<Spawn x="213.8" y="221.5" angle="180"/>
<Spawn x="81.5" y="132.9" angle="270"/>
<Spawn x="192.3" y="81.5" angle="0"/>
<Spawn x="162.3" y="170.1" angle="90"/>
<Spawn x="132.3" y="81.5" angle="180"/>
<Spawn x="243.2" y="132.9" angle="270"/>
<Spawn x="110.9" y="221.5" angle="0"/>
<Spawn x="81.5" y="30" angle="90"/>
<Spawn x="294.6" y="81.5" angle="180"/>
<Spawn x="162.3" y="273" angle="270"/>
<Wall>
<Point x="210.9" y="156.3"/>
<Point x="211.1" y="156.3"/>
<Point x="211.3" y="156.4"/>
<Point x="211.4" y="156.5"/>
<Point x="218.9" y="159.2"/>
<Point x="226.7" y="161.2"/>
<Point x="234.8" y="162.5"/>
<Point x="243.2" y="162.9"/>
<Point x="251.5" y="162.5"/>
<Point x="259.6" y="161.2"/>
<Point x="267.4" y="159.2"/>
<Point x="274.9" y="156.5"/>
<Point x="282" y="153.1"/>
<Point x="288.7" y="149"/>
<Point x="295" y="144.3"/>
<Point x="300.7" y="139"/>
<Point x="306" y="133.3"/>
<Point x="310.7" y="127"/>
<Point x="314.8" y="120.3"/>
<Point x="318.2" y="113.2"/>
<Point x="320.9" y="105.7"/>
<Point x="322.9" y="97.9"/>
<Point x="324.2" y="89.8"/>
<Point x="324.6" y="81.5"/>
<Point x="324.2" y="73.1"/>
<Point x="322.9" y="65"/>
<Point x="320.9" y="57.2"/>
<Point x="318.2" y="49.7"/>
<Point x="314.8" y="42.6"/>
<Point x="310.7" y="35.9"/>
<Point x="306" y="29.6"/>
<Point x="300.7" y="23.9"/>
<Point x="295" y="18.6"/>
<Point x="288.7" y="13.9"/>
<Point x="282" y="9.8"/>
<Point x="274.9" y="6.4"/>
<Point x="267.4" y="3.7"/>
<Point x="259.6" y="1.7"/>
<Point x="251.5" y="0.4"/>
<Point x="243.2" y="0"/>
<Point x="234.8" y="0.4"/>
<Point x="226.7" y="1.7"/>
<Point x="218.9" y="3.7"/>
<Point x="211.4" y="6.4"/>
<Point x="204.3" y="9.8"/>
<Point x="197.6" y="13.9"/>
<Point x="191.3" y="18.6"/>
<Point x="185.6" y="23.9"/>
<Point x="180.3" y="29.6"/>
<Point x="175.6" y="35.9"/>
<Point x="171.5" y="42.6"/>
<Point x="168.1" y="49.7"/>
<Point x="165.4" y="57.2"/>
<Point x="163.4" y="65"/>
<Point x="162.3" y="72"/>
<Point x="161.2" y="65"/>
<Point x="159.2" y="57.2"/>
<Point x="156.5" y="49.7"/>
<Point x="153.1" y="42.6"/>
<Point x="149" y="35.9"/>
<Point x="144.3" y="29.6"/>
<Point x="139" y="23.9"/>
<Point x="133.3" y="18.6"/>
<Point x="127" y="13.9"/>
<Point x="120.3" y="9.8"/>
<Point x="113.2" y="6.4"/>
<Point x="105.7" y="3.7"/>
<Point x="97.9" y="1.7"/>
<Point x="89.8" y="0.4"/>
<Point x="81.5" y="0"/>
<Point x="73.1" y="0.4"/>
<Point x="65" y="1.7"/>
<Point x="57.2" y="3.7"/>
<Point x="49.7" y="6.4"/>
<Point x="42.6" y="9.8"/>
<Point x="35.9" y="13.9"/>
<Point x="29.6" y="18.6"/>
<Point x="23.9" y="23.9"/>
<Point x="18.6" y="29.6"/>
<Point x="13.9" y="35.9"/>
<Point x="9.8" y="42.6"/>
<Point x="6.4" y="49.7"/>
<Point x="3.7" y="57.2"/>
<Point x="1.7" y="65"/>
<Point x="0.4" y="73.1"/>
<Point x="0" y="81.5"/>
<Point x="0.4" y="89.8"/>
<Point x="1.7" y="97.9"/>
<Point x="3.7" y="105.7"/>
<Point x="6.4" y="113.2"/>
<Point x="9.8" y="120.3"/>
<Point x="13.9" y="127"/>
<Point x="18.6" y="133.3"/>
<Point x="23.9" y="139"/>
<Point x="29.6" y="144.3"/>
<Point x="35.9" y="149"/>
<Point x="42.6" y="153.1"/>
<Point x="49.7" y="156.5"/>
<Point x="57.2" y="159.2"/>
<Point x="65" y="161.2"/>
<Point x="73.1" y="162.5"/>
<Point x="81.5" y="162.9"/>
<Point x="89.8" y="162.5"/>
<Point x="97.9" y="161.2"/>
<Point x="105.7" y="159.2"/>
<Point x="113.2" y="156.5"/>
<Point x="113.7" y="156.3"/>
<Point x="110.5" y="158.6"/>
<Point x="104.7" y="163.9"/>
<Point x="99.4" y="169.7"/>
<Point x="94.8" y="176"/>
<Point x="90.7" y="182.7"/>
<Point x="87.3" y="189.8"/>
<Point x="84.5" y="197.3"/>
<Point x="82.5" y="205.1"/>
<Point x="81.3" y="213.2"/>
<Point x="80.9" y="221.5"/>
<Point x="81.3" y="229.8"/>
<Point x="82.5" y="237.9"/>
<Point x="84.5" y="245.7"/>
<Point x="87.3" y="253.2"/>
<Point x="90.7" y="260.3"/>
<Point x="94.8" y="267"/>
<Point x="99.4" y="273.3"/>
<Point x="104.7" y="279.1"/>
<Point x="110.5" y="284.4"/>
<Point x="116.8" y="289"/>
<Point x="123.5" y="293.1"/>
<Point x="130.6" y="296.5"/>
<Point x="138.1" y="299.3"/>
<Point x="145.9" y="301.3"/>
<Point x="154" y="302.5"/>
<Point x="162.3" y="303"/>
<Point x="170.6" y="302.5"/>
<Point x="178.7" y="301.3"/>
<Point x="186.5" y="299.3"/>
<Point x="194" y="296.5"/>
<Point x="201.1" y="293.1"/>
<Point x="207.8" y="289"/>
<Point x="214.1" y="284.4"/>
<Point x="219.9" y="279.1"/>
<Point x="225.2" y="273.3"/>
<Point x="229.8" y="267"/>
<Point x="233.9" y="260.3"/>
<Point x="237.3" y="253.2"/>
<Point x="240.1" y="245.7"/>
<Point x="242.1" y="237.9"/>
<Point x="243.3" y="229.8"/>
<Point x="243.8" y="221.5"/>
<Point x="243.3" y="213.2"/>
<Point x="242.1" y="205.1"/>
<Point x="240.1" y="197.3"/>
<Point x="237.3" y="189.8"/>
<Point x="233.9" y="182.7"/>
<Point x="229.8" y="176"/>
<Point x="225.2" y="169.7"/>
<Point x="219.9" y="163.9"/>
<Point x="214.1" y="158.6"/>
<Point x="210.9" y="156.3"/>
</Wall>
<Wall>
<Point x="194" y="146.5"/>
<Point x="186.5" y="143.7"/>
<Point x="178.7" y="141.7"/>
<Point x="170.6" y="140.5"/>
<Point x="162.3" y="140.1"/>
<Point x="154" y="140.5"/>
<Point x="145.9" y="141.7"/>
<Point x="138.1" y="143.7"/>
<Point x="130.6" y="146.5"/>
<Point x="130" y="146.8"/>
<Point x="133.3" y="144.3"/>
<Point x="139" y="139"/>
<Point x="144.3" y="133.3"/>
<Point x="149" y="127"/>
<Point x="153.1" y="120.3"/>
<Point x="156.5" y="113.2"/>
<Point x="159.2" y="105.7"/>
<Point x="161.2" y="97.9"/>
<Point x="162.3" y="91"/>
<Point x="163.4" y="97.9"/>
<Point x="165.4" y="105.7"/>
<Point x="168.1" y="113.2"/>
<Point x="171.5" y="120.3"/>
<Point x="175.6" y="127"/>
<Point x="180.3" y="133.3"/>
<Point x="185.6" y="139"/>
<Point x="191.3" y="144.3"/>
<Point x="194.6" y="146.8"/>
<Point x="194" y="146.5"/>
</Wall>
</Field>
</World>
</Map>
</Resource>