<?xml version="1.0" encoding="UTF-8" standalone="no"?>
<!DOCTYPE Resource SYSTEM "sty.dtd"> 
<Resource type="aamap" name="compass" version="4" author="rxfreaks" category="hft">
<Map version="0.2.8">
 <Settings>
	<Setting name="delay_command" value="r0 100 spawn_zone teleport 128 240 .5 0 0 0 240 240 abs 1 1 1 false 0 .1 0" />
	<Setting name="delay_command" value="r0 100 spawn_zone teleport 240 128 .5 0 0 0 240 240 abs 1 1 1 false 0 .1 0" />
	<Setting name="delay_command" value="r0 100 spawn_zone teleport 240 352 .5 0 0 0 240 240 abs 1 1 1 false 0 .1 0" />
	<Setting name="delay_command" value="r0 100 spawn_zone teleport 352 240 .5 0 0 0 240 240 abs 1 1 1 false 0 .1 0" />
	<!-- SPAWN_ZONE teleport <x> <y> <size> <growth> <dirx> <diry> <xdest> <ydest> <rel|abs|cycle> <xdirdest> <ydirdest> <relocation_factor><interactive> <r> <g> <b> <target_size> -->
 </Settings>
  <World>
   <Field>
   <Axes number="4"/>

   <Spawn x="464" y="32" xdir="0" ydir="1"/>
   <Spawn x="304" y="32" xdir="0" ydir="1"/>
   <Spawn x="176" y="32" xdir="0" ydir="1"/>
   <Spawn x="32" y="32" xdir="0" ydir="1"/>
   <Spawn x="32" y="480" xdir="0" ydir="-1"/>
   <Spawn x="176" y="480" xdir="0" ydir="-1"/>
   <Spawn x="304" y="480" xdir="0" ydir="-1"/>
   <Spawn x="464" y="480" xdir="0" ydir="-1"/>

   <Wall height="50">
    <Point x="0" y="0"/>
    <Point x="0" y="500"/>
    <Point x="500" y="500"/>
    <Point x="500" y="0"/>
    <Point x="0" y="0"/>
   </Wall>
   <Wall height="5">
    <Point x="208" y="304"/>
    <Point x="240" y="336"/>
    <Point x="272" y="304"/>
    <Point x="240" y="464"/>
    <Point x="208" y="304"/>
   </Wall>
   <Wall height="5">
    <Point x="208" y="176"/>
    <Point x="240" y="144"/>
    <Point x="272" y="176"/>
    <Point x="240" y="32"/>
    <Point x="208" y="176"/>
   </Wall>
   <Wall height="5">
    <Point x="304" y="272"/>
    <Point x="336" y="240"/>
    <Point x="304" y="208"/>
    <Point x="464" y="240"/>
    <Point x="304" y="272"/>
   </Wall>
   <Wall height="5">
    <Point x="176" y="272"/>
    <Point x="144" y="240"/>
    <Point x="176" y="208"/>
    <Point x="32" y="240"/>
    <Point x="176" y="272"/>
   </Wall>

   </Field>
  </World>
 </Map>
</Resource>
