<?xml version="1.0" encoding="ISO-8859-1" standalone="no"?>
<!DOCTYPE Resource SYSTEM "Wik/sty.dtd">
<Resource type="aamap" author="Wik" category="dogfight" name="tiles" version="270612">
<Map version="2">
<World>
<Field>
<Spawn x="273" y="187" angle="180"/>
<Spawn x="20" y="302" angle="0"/>
<Spawn x="20" y="72" angle="0"/>
<Spawn x="169" y="187" angle="0"/>
<Spawn x="124" y="302" angle="180"/>
<Spawn x="124" y="72" angle="180"/>
<Spawn x="221" y="239" angle="270"/>
<Spawn x="72" y="354" angle="270"/>
<Spawn x="72" y="20" angle="90"/>
<Spawn x="221" y="135" angle="90"/>
<Spawn x="72" y="250" angle="90"/>
<Spawn x="72" y="124" angle="270"/>
<Wall>
<Point x="0" y="0"/>
<Point x="144" y="0"/>
<Point x="144" y="115"/>
<Point x="293" y="115"/>
<Point x="293" y="259"/>
<Point x="144" y="259"/>
<Point x="144" y="374"/>
<Point x="0" y="374"/>
<Point x="0" y="230"/>
<Point x="149" y="230"/>
<Point x="149" y="144"/>
<Point x="0" y="144"/>
<Point x="0" y="0"/>
</Wall>
</Field>
</World>
</Map>
</Resource>