<?xml version="1.0" encoding="UTF-8" standalone="no"?>
<!DOCTYPE Resource SYSTEM "sty.dtd"> 
<Resource type="aamap" name="hexagon" version="1" author="rxfreaks" category="hft">
<Map version="0.2.8">
  <World>
   <Field>
   <Axes number="6"/>

   <Spawn x="255" y="50" xdir="0" ydir="1"/>
   <Spawn x="245" y="450" xdir="0" ydir="-1"/>
   <Spawn x="50" y="245" xdir="1" ydir="0"/>
   <Spawn x="450" y="255" xdir="-1" ydir="0"/>
   <Spawn x="305" y="100" xdir="0" ydir="1"/>
   <Spawn x="195" y="400" xdir="0" ydir="-1"/>
   <Spawn x="100" y="195" xdir="1" ydir="0"/>
   <Spawn x="400" y="305" xdir="-1" ydir="0"/>
   <Spawn x="205" y="100" xdir="0" ydir="1"/>
   <Spawn x="295" y="400" xdir="0" ydir="-1"/>
   <Spawn x="100" y="295" xdir="1" ydir="0"/>
   <Spawn x="400" y="205" xdir="-1" ydir="0"/>

   <Wall>
    <Point x="-16" y="240"/>
    <Point x="112" y="496"/>
    <Point x="368" y="496"/>
    <Point x="512" y="256"/>
    <Point x="368" y="16"/>
    <Point x="112" y="16"/>
    <Point x="-16" y="240"/>
   </Wall>

   </Field>
  </World>
 </Map>
</Resource>
