<?xml version="1.0" encoding="ISO-8859-1" standalone="no"?>
<!DOCTYPE Resource SYSTEM "Wik/sty.dtd">
<Resource type="aamap" name="Halftime" version="140813" author="Wik" category="fortress">
<Map version="2">
<World>
<Field>
<Spawn x="125" y="30" angle="90"/>
<Spawn x="125" y="220" angle="270"/>
<Wall>
<Point x="10" y="240"/>
<Point x="10" y="245"/>
<Point x="15" y="245"/>
<Point x="15" y="250"/>
<Point x="235" y="250"/>
<Point x="235" y="245"/>
<Point x="240" y="245"/>
<Point x="240" y="240"/>
<Point x="245" y="240"/>
<Point x="245" y="235"/>
<Point x="250" y="235"/>
<Point x="250" y="15"/>
<Point x="245" y="15"/>
<Point x="245" y="10"/>
<Point x="240" y="10"/>
<Point x="240" y="5"/>
<Point x="235" y="5"/>
<Point x="235" y="0"/>
<Point x="15" y="0"/>
<Point x="15" y="5"/>
<Point x="10" y="5"/>
<Point x="10" y="10"/>
<Point x="5" y="10"/>
<Point x="5" y="15"/>
<Point x="0" y="15"/>
<Point x="0" y="235"/>
<Point x="5" y="235"/>
<Point x="5" y="240"/>
<Point x="10" y="240"/>
</Wall>
<Wall height="0.01">
<Point x="244" y="9"/>
<Point x="244" y="5"/>
<Point x="245" y="6"/>
<Point x="246" y="5"/>
<Point x="246" y="9"/>
</Wall>
<Wall height="0.01">
<Point x="247" y="9"/>
<Point x="247" y="5"/>
</Wall>
<Wall height="0.01">
<Point x="248" y="9"/>
<Point x="248" y="5"/>
</Wall>
<Wall height="0.01">
<Point x="250" y="9"/>
<Point x="248" y="7"/>
<Point x="250" y="5"/>
</Wall>
<Wall height="0.01">
<Point x="241" y="3"/>
<Point x="242" y="4"/>
<Point x="243" y="3"/>
<Point x="243" y="2"/>
<Point x="241" y="0"/>
<Point x="243" y="0"/>
</Wall>
<Wall height="0.01">
<Point x="244" y="3"/>
<Point x="245" y="4"/>
<Point x="246" y="3"/>
<Point x="246" y="1"/>
<Point x="245" y="0"/>
<Point x="244" y="1"/>
<Point x="244" y="3"/>
</Wall>
<Wall height="0.01">
<Point x="247" y="4"/>
<Point x="247" y="0"/>
</Wall>
<Wall height="0.01">
<Point x="248" y="3"/>
<Point x="249" y="4"/>
<Point x="250" y="3"/>
<Point x="249" y="2"/>
<Point x="250" y="1"/>
<Point x="249" y="0"/>
<Point x="248" y="1"/>
</Wall>
<Zone effect="fortress"><ShapeCircle radius="20"><Point x="125" y="30"/></ShapeCircle></Zone>
<Zone effect="fortress"><ShapeCircle radius="20"><Point x="125" y="220"/></ShapeCircle></Zone>
</Field>
</World>
</Map>
</Resource>